{
  "$schema": "https://json-schema.org/draft/2020-12/schema",
  "$id": "https://relux-works.github.io/curator-spec/schemas/v1/conformance-claim-v1.schema.json",
  "title": "Curator Protocol conformance claim schema 1",
  "type": "object",
  "required": ["schema_version", "protocol_version", "implementation", "implementation_version", "classes", "suite_sha256", "operating_systems", "created_at", "result"],
  "properties": {
    "schema_version": {"const": 1},
    "protocol_version": {"const": "1.0.0-rc.2"},
    "implementation": {"$ref": "common.schema.json#/$defs/nonEmptyString"},
    "implementation_version": {"$ref": "common.schema.json#/$defs/nonEmptyString"},
    "classes": {"type": "array", "minItems": 1, "items": {"enum": ["core", "manager", "registry-client", "registry-service"]}, "uniqueItems": true},
    "suite_sha256": {"$ref": "common.schema.json#/$defs/sha256"},
    "operating_systems": {"type": "array", "minItems": 1, "items": {"enum": ["linux", "macos", "windows"]}, "uniqueItems": true},
    "created_at": {"$ref": "common.schema.json#/$defs/timestamp"},
    "result": {"const": "pass"}
  },
  "additionalProperties": false
}
